{
  "schema_version": "registry-manifest/v2",
  "registry_id": "tinlance.agent.ecosystem",
  "baseline_id": "ecosystem-p5-governance-v2-candidate-2026-10-18",
  "repositories": [
    {
      "id": "developer",
      "repository": "LloydCoder/tinlance-agent-developer",
      "reviewed_sha": "0dd17c4a4ae1075769e9254b8f36ba131d3f4c74",
      "role": "developer validation consumer",
      "publisher": {
        "publisher_id": "LloydCoder",
        "identity_uri": "https://github.com/LloydCoder",
        "identity_status": "unverified"
      },
      "lifecycle": {
        "state": "active",
        "changed_at": "2026-10-18T06:52:00Z",
        "reason": null,
        "replacement_id": null
      },
      "supply_chain": {
        "reviewed_sha": "0dd17c4a4ae1075769e9254b8f36ba131d3f4c74",
        "provenance_uri": "https://github.com/LloydCoder/tinlance-agent-developer/commit/0dd17c4a4ae1075769e9254b8f36ba131d3f4c74",
        "sbom_uri": "https://github.com/LloydCoder/tinlance-agent-developer/attestations",
        "signature_uri": "https://github.com/LloydCoder/tinlance-agent-developer/attestations",
        "verification_status": "pending"
      }
    },
    {
      "id": "os",
      "repository": "LloydCoder/tinlance-agent-os",
      "reviewed_sha": "62826433a3110f7d29fd8dc7295efa584fa7934e",
      "role": "operating environment and lifecycle plane",
      "publisher": {
        "publisher_id": "LloydCoder",
        "identity_uri": "https://github.com/LloydCoder",
        "identity_status": "unverified"
      },
      "lifecycle": {
        "state": "active",
        "changed_at": "2026-10-18T06:52:00Z",
        "reason": null,
        "replacement_id": null
      },
      "supply_chain": {
        "reviewed_sha": "62826433a3110f7d29fd8dc7295efa584fa7934e",
        "provenance_uri": "https://github.com/LloydCoder/tinlance-agent-os/commit/62826433a3110f7d29fd8dc7295efa584fa7934e",
        "sbom_uri": "https://github.com/LloydCoder/tinlance-agent-os/attestations",
        "signature_uri": "https://github.com/LloydCoder/tinlance-agent-os/attestations",
        "verification_status": "pending"
      }
    },
    {
      "id": "platform",
      "repository": "LloydCoder/tinlance-agent-platform",
      "reviewed_sha": "146481f762ea532a2be2e55f45234c351d2dddc8",
      "role": "sole governed execution and authority plane",
      "publisher": {
        "publisher_id": "LloydCoder",
        "identity_uri": "https://github.com/LloydCoder",
        "identity_status": "unverified"
      },
      "lifecycle": {
        "state": "active",
        "changed_at": "2026-10-18T06:52:00Z",
        "reason": null,
        "replacement_id": null
      },
      "supply_chain": {
        "reviewed_sha": "146481f762ea532a2be2e55f45234c351d2dddc8",
        "provenance_uri": "https://github.com/LloydCoder/tinlance-agent-platform/commit/146481f762ea532a2be2e55f45234c351d2dddc8",
        "sbom_uri": "https://github.com/LloydCoder/tinlance-agent-platform/attestations",
        "signature_uri": "https://github.com/LloydCoder/tinlance-agent-platform/attestations",
        "verification_status": "pending"
      }
    },
    {
      "id": "platform_sdk",
      "repository": "LloydCoder/tinlance-agent-platform-sdk",
      "reviewed_sha": "2f358d5dd1e562918613f138b7ef1e3a16f693cb",
      "role": "typed developer API surface",
      "publisher": {
        "publisher_id": "LloydCoder",
        "identity_uri": "https://github.com/LloydCoder",
        "identity_status": "unverified"
      },
      "lifecycle": {
        "state": "active",
        "changed_at": "2026-10-18T06:52:00Z",
        "reason": null,
        "replacement_id": null
      },
      "supply_chain": {
        "reviewed_sha": "2f358d5dd1e562918613f138b7ef1e3a16f693cb",
        "provenance_uri": "https://github.com/LloydCoder/tinlance-agent-platform-sdk/commit/2f358d5dd1e562918613f138b7ef1e3a16f693cb",
        "sbom_uri": "https://github.com/LloydCoder/tinlance-agent-platform-sdk/attestations",
        "signature_uri": "https://github.com/LloydCoder/tinlance-agent-platform-sdk/attestations",
        "verification_status": "pending"
      }
    },
    {
      "id": "tsic",
      "repository": "LloydCoder/tinlance-system-integration",
      "reviewed_sha": "e98613c56c7cc52e063557987bb5436cfb24d207",
      "role": "canonical contract and conformance authority",
      "publisher": {
        "publisher_id": "LloydCoder",
        "identity_uri": "https://github.com/LloydCoder",
        "identity_status": "unverified"
      },
      "lifecycle": {
        "state": "active",
        "changed_at": "2026-10-18T06:52:00Z",
        "reason": null,
        "replacement_id": null
      },
      "supply_chain": {
        "reviewed_sha": "e98613c56c7cc52e063557987bb5436cfb24d207",
        "provenance_uri": "https://github.com/LloydCoder/tinlance-system-integration/commit/e98613c56c7cc52e063557987bb5436cfb24d207",
        "sbom_uri": "https://github.com/LloydCoder/tinlance-system-integration/attestations",
        "signature_uri": "https://github.com/LloydCoder/tinlance-system-integration/attestations",
        "verification_status": "pending"
      }
    }
  ],
  "services": [
    {
      "service_id": "agent-platform.api",
      "owner_repository_id": "platform",
      "version": "1.0.0",
      "api_version": "1.1",
      "contract_ids": [
        "governed-execution.v1",
        "event-envelope.v1",
        "trace-context.v1"
      ],
      "capabilities": [
        "agent.execute",
        "approval.resolve",
        "evidence.record",
        "tool.invoke"
      ],
      "authority_mode": "sole_consequential_execution",
      "enabled": true,
      "lifecycle": {
        "state": "active",
        "changed_at": "2026-10-18T06:52:00Z",
        "reason": null,
        "replacement_id": null
      }
    },
    {
      "service_id": "agent-os.runtime",
      "owner_repository_id": "os",
      "version": "1.0.0",
      "api_version": "1.1",
      "contract_ids": [
        "event-envelope.v1",
        "trace-context.v1"
      ],
      "capabilities": [
        "event.publish",
        "task.orchestrate",
        "trace.propagate"
      ],
      "authority_mode": "authority_free",
      "enabled": true,
      "lifecycle": {
        "state": "active",
        "changed_at": "2026-10-18T06:52:00Z",
        "reason": null,
        "replacement_id": null
      }
    },
    {
      "service_id": "platform-sdk.client",
      "owner_repository_id": "platform_sdk",
      "version": "1.0.0",
      "api_version": "1.1",
      "contract_ids": [
        "governed-execution.v1",
        "event-envelope.v1",
        "trace-context.v1"
      ],
      "capabilities": [
        "request.submit",
        "trace.propagate"
      ],
      "authority_mode": "authority_free",
      "enabled": true,
      "lifecycle": {
        "state": "active",
        "changed_at": "2026-10-18T06:52:00Z",
        "reason": null,
        "replacement_id": null
      }
    },
    {
      "service_id": "tadl.validator",
      "owner_repository_id": "developer",
      "version": "1.0.0",
      "api_version": "1.1",
      "contract_ids": [
        "transformation.v1",
        "replication.v1",
        "trace-context.v1",
        "registry-manifest.v2"
      ],
      "capabilities": [
        "artifact.validate",
        "registry.validate"
      ],
      "authority_mode": "authority_free",
      "enabled": true,
      "lifecycle": {
        "state": "active",
        "changed_at": "2026-10-18T06:52:00Z",
        "reason": null,
        "replacement_id": null
      }
    },
    {
      "service_id": "tsic.conformance",
      "owner_repository_id": "tsic",
      "version": "1.0.0",
      "api_version": "1.1",
      "contract_ids": [
        "event-envelope.v1",
        "trace-context.v1",
        "registry-manifest.v2"
      ],
      "capabilities": [
        "compatibility.validate",
        "contract.validate"
      ],
      "authority_mode": "conformance_only",
      "enabled": true,
      "lifecycle": {
        "state": "active",
        "changed_at": "2026-10-18T06:52:00Z",
        "reason": null,
        "replacement_id": null
      }
    }
  ],
  "agents": [
    {
      "agent_id": "reference.enterprise-a",
      "owner_repository_id": "platform",
      "version": "1.0.0",
      "capabilities": [
        "agent.execute",
        "tool.invoke",
        "event.publish"
      ],
      "required_contracts": {
        "governed-execution.v1": "1.0",
        "event-envelope.v1": "1.0",
        "trace-context.v1": "1.0"
      },
      "authority_mode": "delegated_only",
      "lifecycle": {
        "state": "active",
        "changed_at": "2026-10-18T06:52:00Z",
        "reason": null,
        "replacement_id": null
      }
    },
    {
      "agent_id": "reference.enterprise-b",
      "owner_repository_id": "platform",
      "version": "1.0.0",
      "capabilities": [
        "agent.execute",
        "tool.invoke",
        "event.publish"
      ],
      "required_contracts": {
        "governed-execution.v1": "1.0",
        "event-envelope.v1": "1.0",
        "trace-context.v1": "1.0"
      },
      "authority_mode": "delegated_only",
      "lifecycle": {
        "state": "active",
        "changed_at": "2026-10-18T06:52:00Z",
        "reason": null,
        "replacement_id": null
      }
    }
  ],
  "contracts": [
    {
      "contract_id": "governed-execution.v1",
      "version": "1.0",
      "schema_path": "packages/contracts/src/tinlance_agent_platform_contracts/models.py",
      "owner_repository_id": "platform",
      "compatibility": "versioned_immutable",
      "lifecycle": {
        "state": "active",
        "changed_at": "2026-10-18T06:52:00Z",
        "reason": null,
        "replacement_id": null
      }
    },
    {
      "contract_id": "event-envelope.v1",
      "version": "1.0",
      "schema_path": "contracts/events/envelope.json",
      "owner_repository_id": "tsic",
      "compatibility": "versioned_immutable",